产品大类 	细分产品 	具体产品 								
14 	卷绕臂及导管卷绕装置 	ZL201620958960.3 	申请取得 	2016.8.25 	10年 	迈得医疗 				
										
15 	开袋机构 	ZL201620967473.3 	申请取得 	2016.8.25 	10年 	迈得医疗 				
16 	夹具旋转定位装置与包括该装置的固化设备 	ZL201620952746.7 	申请取得 	2016.8.24 	10年 	迈得医疗 				
16 	夹具旋转定位装置与包括该装置的固化设备 	ZL201620952746.7 	申请取得 	2016.8.24 	10年 	迈得医疗 				
										
17 	透析器注胶盖移除装置 	ZL201620952969.3 	申请取得 	2016.8.24 	10年 	迈得医疗 				
										
18 	透析器离心注胶供电装置及透析器离心注胶装置 	ZL201620953077.5 	申请取得 	2016.8.24 	10年 	迈得医疗 				
19 	金属针组件组装装置 	ZL201620938353.0 	申请取得 	2016.8.23 	10年 	迈得医疗 				
19 	金属针组件组装装置 	ZL201620938353.0 	申请取得 	2016.8.23 	10年 	迈得医疗 				
										
20 	医用金属针及医用金属针的制造设备 	ZL201620940823.7 	申请取得 	2016.8.23 	10年 	迈得医疗 				
										
21 	多焊头超声波焊接装置 	ZL201620945942.1 	申请取得 	2016.8.23 	10年 	迈得医疗 				
22 	透析器旋转定位装置 	ZL201620923950.6 	申请取得 	2016.8.21 	10年 	迈得医疗 				
22 	透析器旋转定位装置 	ZL201620923950.6 	申请取得 	2016.8.21 	10年 	迈得医疗 				
										
23 	导管装袋装置 	ZL201620699934.3 	申请取得 	2016.7.3 	10年 	迈得医疗 				
										
24 	包装袋供料系统 	ZL201620700068.5 	申请取得 	2016.7.3 	10年 	迈得医疗 				
25 	喷码装置 	ZL201620701628.9 	申请取得 	2016.7.3 	10年 	迈得医疗 				
25 	喷码装置 	ZL201620701628.9 	申请取得 	2016.7.3 	10年 	迈得医疗 				
										
26 	张袋系统 	ZL201620707317.3 	申请取得 	2016.7.3 	10年 	迈得医疗 				
										
27 	软管接头的安装装置 	ZL201720444411.9 	申请取得 	2017.4.25 	10年 	迈得医疗 				
28 	软管切割装置 	ZL201720355983.X 	申请取得 	2017.4.6 	10年 	迈得医疗 				
28 	软管切割装置 	ZL201720355983.X 	申请取得 	2017.4.6 	10年 	迈得医疗 				
										
29 	工件夹持装置及具有其的自动夹持组件 	ZL201720351735.8 	申请取得 	2017.4.5 	10年 	迈得医疗 				
										
30 	留置针的封堵装置 	ZL201720327702.X 	申请取得 	2017.3.30 	10年 	迈得医疗 				
31 	封堵结构和透析器检测设备 	ZL201720328027.2 	申请取得 	2017.3.30 	10年 	迈得医疗 				
31 	封堵结构和透析器检测设备 	ZL201720328027.2 	申请取得 	2017.3.30 	10年 	迈得医疗 				
										
32 	软管扩口装置 	ZL201720212714.8 	申请取得 	2017.3.6 	10年 	迈得				
										
医疗 										
										
迈得医疗 										
										
迈得医疗 										
迈得医疗 										
迈得医疗 										
										
迈得医疗 										
										
迈得医疗 										
迈得医疗 										
迈得医疗 										
										
迈得医疗 										
										
迈得医疗 										
										
33 	绕拢装置和具有其的导管卷绕系统 	ZL201720152265.2 	申请取得 	2017.2.20 	10年 					
										
34 	上料装置 	ZL201720092712.X 	申请取得 	2017.1.22 	10年 					
35 	柔性管捋直定位机构 	ZL201720102831.9 	申请取得 	2017.1.22 	10年 					
35 	柔性管捋直定位机构 	ZL201720102831.9 	申请取得 	2017.1.22 	10年 					
										
36 	医疗配件上料装置 	ZL201621431841.9 	申请取得 	2016.12.23 	10年 					
										
37 	透析器切胶刀、透析器切胶模组和透析器切胶装置 	ZL201621431861.6 	申请取得 	2016.12.23 	10年 					
38 	医疗配件定向供料装置 	ZL201621432243.3 	申请取得 	2016.12.23 	10年 					
38 	医疗配件定向供料装置 	ZL201621432243.3 	申请取得 	2016.12.23 	10年 					
										
39 	透析器切胶装置 	ZL201621432657.6 	申请取得 	2016.12.23 	10年 					
										
40 	医疗配件上料装置 	ZL201621435471.6 	申请取得 	2016.12.23 	10年 					
										
序号 	专利名称 	专利号 	获得方式 	申请日期 	有效期 	权属 				
										
1 	回转式自动化组装设备 	ZL201230006684.8 	申请取得 	2012.01.11 	10年 	迈得医疗 				
										
序号 	名称 	登记号 	取得方式 	首次发表日期 	权属 					
										
1 	迈得医疗控制系统软件 V1.0 	2014SR015570 	原始取得 	— 	迈得医疗 					
										
2 	迈得医用采血管装配系统控制软件 V1.0 	2015SR202371 	原始取得 	2015 年 4 月 30 日 	迈得医疗 					
										
3 	迈得医用导管上料系统控制软件 V1.0 	2015SR202808 	原始取得 	2015 年 4 月 30 日 	迈得医疗 					
										
4 	迈得医疗工业控制系统软件V2.0 	2017SR203587 	原始取得 	2017 年 3 月 10 日 	迈得医疗 					
										
5 	医用导管挤切系统控制软件	2017SR606607 	原始取得 	2017 年 9 月 1 日 	迈得医疗 					
										
V1.0 										
										
医用过滤器装配系统控制软件V1.0 	2017SR606689 	原始取得 	2017 年 9 月 1 日 	迈得医疗 						
										
医用金属针装配系统控制软件V1.0 	2017SR552747 	原始取得 	2017 年 8 月 1 日 	迈得医疗 						
										
医用输液器装配系统控制软件V1.0 	2017SR606738 	原始取得 	2017 年 9 月 1 日 	迈得医疗 						
										
医用输注器装配系统控制软件V1.0 	2017SR611487 	原始取得 	2017 年 9 月 1 日 	迈得医疗 						
										
医用针细导管装配系统控制软件 V1.0 	2017SR606599 	原始取得 	2017 年 9 月 1 日 	迈得医疗 						
										
6 										
										
7 										
										
8 										
										
9 										
										
10 										
										
序号 	软件名称 	证书编号 	取得方式 	有效期 	权属 					
										
1 	迈得医疗控制系统软件 V1.0 	浙 DGY-2013-2068 	原始取得 	2013.12.9-2018.12.9 	迈得医疗 					
										
序号 	承租人 	出租人 	房屋地址 	面积 	实际用途 	租赁价格 	租赁期限 	房屋权属证书 	备案登记 	
1 	天津 迈得 	天津市创佳时代科技企业管理有限公司 	天津市河北区志成路 130号（自创区河北分园科技招商展示服务中心 217室） 	207m2 	办公场地 	1.1 元/平米/天，之后逐年递增 0.1 元/平米/天 	2017 年 8 月 1日至 2020 年7 月 31 日 	津字第105011519238 [注] 	否 	
2 	迈得 国际 	戈平根商业园有限公司 	曼弗里德-沃尔纳大街 125号施淘费商业园 2 座三楼（西面） 	255 m2 	办公场地 	4,129.30欧元/月 	2017 年 6 月 1日至 2022 年5 月 31 日 	房地产权登记簿编号为21666 	- 	
3 	迈得 医疗 	东莞市中创盈科物业投资有限公司 	东莞市万江街道金泰社区金曲璐金泰工业区产业楼 8 栋 101号 	310 m2 	接 收和检验定制采购件的场所 	23.76 元/平米/月 	2017 年 12 月27 日至 2019年 9 月 6 日 	东莞房地产权证登记字号03220023 	否 	
4 	迈得 医疗 	聂宏国 	东莞市万江区新城金曲路 18 号北大资源御湾商住区 15 楼 1单元 1504 	93.75 m2 	员工宿舍 	3,743 元 /月 	2017 年 12 月27 日至 2018年 12 月 27 日 	粤房地权证莞字第0300794522号 	否 	
										
序号 	技术名称 	技术说明 	生产技术所处阶段 							
1 	精确的料仓供料技术 	通过光纤定位控制、CCD 影像技术、软件控制技术、机械手实现医用耗材不规则组件有序、准确地进入随行夹具内，有效解决因医用耗材组件形状不规则导致的供料难、生产效率低、合格率低、生产人员容易引起二次污染等问题。 	大批量生产 							
2 	螺旋振动供料技术 	采用螺旋振动供料系统，配合光纤传感定位系统、机械手技术，使医用耗材组件按照特定方向逐一排序快速进料，无需人工参与，避免二次污染。 	大批量生产 							
3 	输送控制技术 	利用 PLC 控制技术、光纤传感定位技术以及伺服电机控制技术的集成，有效控制医用制品组件在输送过程中的稳定性、定位准确性，为装配、检测工序提供保障，有效保证了医用制品装配自动化设备在运行过程中的稳定性。 	大批量生产 							
4 	转盘涂胶技术 	采用新型转盘涂胶技术可有效解决针尖跟针座的涂胶不均匀、不饱满问题，同时大大减轻医疗器械生产企业员工劳动强度，在减少用人的同时，良好地解决了涂胶环节的二次污染问题。 	大批量生产 							
5 	定性定量管道涂胶技术 	采用智能可控的涂胶技术，实现每次管道内外径涂胶量的一致性，解决了传统生产模式中管道内外径涂胶不均匀或不饱满或过多等现象。 	大批量生产 							
6 	智能 UV涂胶技术 	可视读控制器控制每次涂胶的进胶量，保证每次涂胶的均匀、饱满、不过多且一致性，有效解决传统人工涂胶模式中存在的涂胶不均匀、过多或过少、劳动强度大等问题。 	大批量生产 							
7 	医用导管卷绕技术 	在卷绕装置设置支杆、夹头和张紧装置，使医用导管在卷绕过程中保持紧绷状态，医用导管在整个卷绕过程中处于紧绷的状态，使卷绕好的医用导管紧绷扎实。该技术主要应用于	大批量生产 							
										
公司的医用导管类自动化组装设备 										
将转轴插接在机架上且能够周向自由转动，转轴上固定有用于夹持医用针的针管的机械手，且当针管夹持于机械手上时与转轴处于同心位置，转轴和机架之间设有用于驱动转轴周向转动的旋转机构。本发明可根据实际情况任意的调整针管的转动角度，避免针管变形。 	大批量生产 									
该技术是公司的自动化设备中的核心，采用特制机械手吸取或抓取医用导管，配合导管定位装置，有效解决因导管是柔性材料、形状不规则且比较细小而导致的装配难、装配过程中易损伤等问题，有效提升产品生产效率的同时，保证了产品的质量。 	大批量生产 									
在线智能影像视觉检测技术涉及图像的预处理，采用中值滤波、大津阈值分割、图像矫正的方法对图像进行预处理，中值滤波器产生的模数较少，更适于消除图像的孤立噪声点，是经典的平滑噪声的方法，对医用制品组件图像滤波以后，平滑掉了图像噪声，保留了图像细节，然后对图像进行大津阈值分割、图像矫正处理，修正后的图像细节比较明显，对比度增强，更容易检测医用制品的合格情况，以该检测技术代替传统的人工检测，检测医用制品组件各类物理性能数据，配合上位机系统，记录分析整个检测过程，代替人工的数据记录。 	大批量生产 									
										
8 	医用针刃面定位技术 									
9 	柔性装配技术 									
10 	在线智能视觉检测技术 									
										
序号 	项目名称 	拟达成目标 	技术来源 							
1 	基于智能视觉检测、伺服控制的在线针尖刃面校正技术 	国内领先 	自主研发 							
2 	一种在线随动密封性检测技术的研发 	国内领先 	自主研发 							
3 	一种导管柔性包装技术的研发 	国内领先 	自主研发 							
4 	一种新型的毛刺视觉检测算法 	国内领先 	自主研发 							
5 	一种应用于曲面凹凸缺陷的视觉检测算法 	国内领先 	自主研发 							
6 	三相机确定针管刃面角度的检测算法 	国内领先 	自主研发 							
7 	针尖成膜技术 	国内领先 	自主研发 							
8 	随动测漏保压技术 	国内领先 	自主研发 							
9 	说明书与合格证折叠入袋方法 	国内领先 	自主研发 							
10 	自动清洗灭菌系统的研发 	国内领先 	自主研发 							
11 	多导管同时组装工艺的研究 	国内领先 	自主研发 							
12 	一种包装袋在线裁切技术的研究 	国内领先 	自主研发 							
13 	UV 胶双罐供液系统 	国内领先 	自主研发 							
										
项目 	2017 年 	2016 年 	2015 年 							
研发支出 	1,381.58 	1,369.66 	1,266.69 							
营业收入 	17,338.90 	13,943.06 	14,471.53 							
研发支出占营业收入的比例 	7.98% 	9.82% 	8.75% 							
										
